[INFO] Scanning for projects...
[INFO] 
[INFO] ----------------------< org.revature:Challenges >-----------------------
[INFO] Building Challenges 1.1
[INFO] --------------------------------[ jar ]---------------------------------
[INFO] 
[INFO] --- maven-resources-plugin:2.6:resources (default-resources) @ Challenges ---
[WARNING] Using platform encoding (UTF-8 actually) to copy filtered resources, i.e. build is platform dependent!
[INFO] Copying 1 resource
[INFO] 
[INFO] --- maven-compiler-plugin:3.1:compile (default-compile) @ Challenges ---
[INFO] Nothing to compile - all classes are up to date
[INFO] 
[INFO] --- maven-resources-plugin:2.6:testResources (default-testResources) @ Challenges ---
[WARNING] Using platform encoding (UTF-8 actually) to copy filtered resources, i.e. build is platform dependent!
[INFO] skip non existing resourceDirectory /workspace/joy432-pep-project/src/test/resources
[INFO] 
[INFO] --- maven-compiler-plugin:3.1:testCompile (default-testCompile) @ Challenges ---
[INFO] Nothing to compile - all classes are up to date
[INFO] 
[INFO] --- maven-surefire-plugin:3.0.0-M7:test (default-test) @ Challenges ---
[INFO] Using configured provider org.apache.maven.surefire.junitcore.JUnitCoreProvider
[INFO] 
[INFO] -------------------------------------------------------
[INFO]  T E S T S
[INFO] -------------------------------------------------------
[INFO] Running AuthIntegrationTest
[INFO] Tests run: 7, Failures: 0, Errors: 0, Skipped: 0, Time elapsed: 9.3 s - in AuthIntegrationTest
[INFO] Running MessagingIntegrationTest
null
[ERROR] Tests run: 20, Failures: 14, Errors: 1, Skipped: 0, Time elapsed: 20.685 s <<< FAILURE! - in MessagingIntegrationTest
[ERROR] MessagingIntegrationTest.postAccountAndMessageThenGetMessageTest  Time elapsed: 0.962 s  <<< FAILURE!
java.lang.AssertionError: expected:<200> but was:<400>
	at org.junit.Assert.fail(Assert.java:89)
	at org.junit.Assert.failNotEquals(Assert.java:835)
	at org.junit.Assert.assertEquals(Assert.java:647)
	at org.junit.Assert.assertEquals(Assert.java:633)
	at MessagingIntegrationTest.postAccountAndMessageTest(MessagingIntegrationTest.java:140)
	at MessagingIntegrationTest.postAccountAndMessageThenGetMessageTest(MessagingIntegrationTest.java:207)
	at java.base/jdk.internal.reflect.NativeMethodAccessorImpl.invoke0(Native Method)
	at java.base/jdk.internal.reflect.NativeMethodAccessorImpl.invoke(NativeMethodAccessorImpl.java:62)
	at java.base/jdk.internal.reflect.DelegatingMethodAccessorImpl.invoke(DelegatingMethodAccessorImpl.java:43)
	at java.base/java.lang.reflect.Method.invoke(Method.java:566)
	at org.junit.runners.model.FrameworkMethod$1.runReflectiveCall(FrameworkMethod.java:59)
	at org.junit.internal.runners.model.ReflectiveCallable.run(ReflectiveCallable.java:12)
	at org.junit.runners.model.FrameworkMethod.invokeExplosively(FrameworkMethod.java:56)
	at org.junit.internal.runners.statements.InvokeMethod.evaluate(InvokeMethod.java:17)
	at org.junit.internal.runners.statements.RunBefores.evaluate(RunBefores.java:26)
	at org.junit.internal.runners.statements.RunAfters.evaluate(RunAfters.java:27)
	at org.junit.runners.ParentRunner$3.evaluate(ParentRunner.java:306)
	at org.junit.runners.BlockJUnit4ClassRunner$1.evaluate(BlockJUnit4ClassRunner.java:100)
	at org.junit.runners.ParentRunner.runLeaf(ParentRunner.java:366)
	at org.junit.runners.BlockJUnit4ClassRunner.runChild(BlockJUnit4ClassRunner.java:103)
	at org.junit.runners.BlockJUnit4ClassRunner.runChild(BlockJUnit4ClassRunner.java:63)
	at org.junit.runners.ParentRunner$4.run(ParentRunner.java:331)
	at org.junit.runners.ParentRunner$1.schedule(ParentRunner.java:79)
	at org.junit.runners.ParentRunner.runChildren(ParentRunner.java:329)
	at org.junit.runners.ParentRunner.access$100(ParentRunner.java:66)
	at org.junit.runners.ParentRunner$2.evaluate(ParentRunner.java:293)
	at org.junit.runners.ParentRunner$3.evaluate(ParentRunner.java:306)
	at org.junit.runners.ParentRunner.run(ParentRunner.java:413)
	at org.junit.runners.Suite.runChild(Suite.java:128)
	at org.junit.runners.Suite.runChild(Suite.java:27)
	at org.junit.runners.ParentRunner$4.run(ParentRunner.java:331)
	at org.junit.runners.ParentRunner$1.schedule(ParentRunner.java:79)
	at org.junit.runners.ParentRunner.runChildren(ParentRunner.java:329)
	at org.junit.runners.ParentRunner.access$100(ParentRunner.java:66)
	at org.junit.runners.ParentRunner$2.evaluate(ParentRunner.java:293)
	at org.junit.runners.ParentRunner$3.evaluate(ParentRunner.java:306)
	at org.junit.runners.ParentRunner.run(ParentRunner.java:413)
	at org.apache.maven.surefire.junitcore.JUnitCore.run(JUnitCore.java:55)
	at org.apache.maven.surefire.junitcore.JUnitCoreWrapper.createRequestAndRun(JUnitCoreWrapper.java:137)
	at org.apache.maven.surefire.junitcore.JUnitCoreWrapper.executeEager(JUnitCoreWrapper.java:107)
	at org.apache.maven.surefire.junitcore.JUnitCoreWrapper.execute(JUnitCoreWrapper.java:83)
	at org.apache.maven.surefire.junitcore.JUnitCoreWrapper.execute(JUnitCoreWrapper.java:75)
	at org.apache.maven.surefire.junitcore.JUnitCoreProvider.invoke(JUnitCoreProvider.java:158)
	at org.apache.maven.surefire.booter.ForkedBooter.runSuitesInProcess(ForkedBooter.java:456)
	at org.apache.maven.surefire.booter.ForkedBooter.execute(ForkedBooter.java:169)
	at org.apache.maven.surefire.booter.ForkedBooter.run(ForkedBooter.java:595)
	at org.apache.maven.surefire.booter.ForkedBooter.main(ForkedBooter.java:581)

[ERROR] MessagingIntegrationTest.deleteMessageNonExistentMessageTest  Time elapsed: 1.055 s  <<< FAILURE!
java.lang.AssertionError: expected:<200> but was:<500>
	at org.junit.Assert.fail(Assert.java:89)
	at org.junit.Assert.failNotEquals(Assert.java:835)
	at org.junit.Assert.assertEquals(Assert.java:647)
	at org.junit.Assert.assertEquals(Assert.java:633)
	at MessagingIntegrationTest.deleteMessageNonExistentMessageTest(MessagingIntegrationTest.java:391)
	at java.base/jdk.internal.reflect.NativeMethodAccessorImpl.invoke0(Native Method)
	at java.base/jdk.internal.reflect.NativeMethodAccessorImpl.invoke(NativeMethodAccessorImpl.java:62)
	at java.base/jdk.internal.reflect.DelegatingMethodAccessorImpl.invoke(DelegatingMethodAccessorImpl.java:43)
	at java.base/java.lang.reflect.Method.invoke(Method.java:566)
	at org.junit.runners.model.FrameworkMethod$1.runReflectiveCall(FrameworkMethod.java:59)
	at org.junit.internal.runners.model.ReflectiveCallable.run(ReflectiveCallable.java:12)
	at org.junit.runners.model.FrameworkMethod.invokeExplosively(FrameworkMethod.java:56)
	at org.junit.internal.runners.statements.InvokeMethod.evaluate(InvokeMethod.java:17)
	at org.junit.internal.runners.statements.RunBefores.evaluate(RunBefores.java:26)
	at org.junit.internal.runners.statements.RunAfters.evaluate(RunAfters.java:27)
	at org.junit.runners.ParentRunner$3.evaluate(ParentRunner.java:306)
	at org.junit.runners.BlockJUnit4ClassRunner$1.evaluate(BlockJUnit4ClassRunner.java:100)
	at org.junit.runners.ParentRunner.runLeaf(ParentRunner.java:366)
	at org.junit.runners.BlockJUnit4ClassRunner.runChild(BlockJUnit4ClassRunner.java:103)
	at org.junit.runners.BlockJUnit4ClassRunner.runChild(BlockJUnit4ClassRunner.java:63)
	at org.junit.runners.ParentRunner$4.run(ParentRunner.java:331)
	at org.junit.runners.ParentRunner$1.schedule(ParentRunner.java:79)
	at org.junit.runners.ParentRunner.runChildren(ParentRunner.java:329)
	at org.junit.runners.ParentRunner.access$100(ParentRunner.java:66)
	at org.junit.runners.ParentRunner$2.evaluate(ParentRunner.java:293)
	at org.junit.runners.ParentRunner$3.evaluate(ParentRunner.java:306)
	at org.junit.runners.ParentRunner.run(ParentRunner.java:413)
	at org.junit.runners.Suite.runChild(Suite.java:128)
	at org.junit.runners.Suite.runChild(Suite.java:27)
	at org.junit.runners.ParentRunner$4.run(ParentRunner.java:331)
	at org.junit.runners.ParentRunner$1.schedule(ParentRunner.java:79)
	at org.junit.runners.ParentRunner.runChildren(ParentRunner.java:329)
	at org.junit.runners.ParentRunner.access$100(ParentRunner.java:66)
	at org.junit.runners.ParentRunner$2.evaluate(ParentRunner.java:293)
	at org.junit.runners.ParentRunner$3.evaluate(ParentRunner.java:306)
	at org.junit.runners.ParentRunner.run(ParentRunner.java:413)
	at org.apache.maven.surefire.junitcore.JUnitCore.run(JUnitCore.java:55)
	at org.apache.maven.surefire.junitcore.JUnitCoreWrapper.createRequestAndRun(JUnitCoreWrapper.java:137)
	at org.apache.maven.surefire.junitcore.JUnitCoreWrapper.executeEager(JUnitCoreWrapper.java:107)
	at org.apache.maven.surefire.junitcore.JUnitCoreWrapper.execute(JUnitCoreWrapper.java:83)
	at org.apache.maven.surefire.junitcore.JUnitCoreWrapper.execute(JUnitCoreWrapper.java:75)
	at org.apache.maven.surefire.junitcore.JUnitCoreProvider.invoke(JUnitCoreProvider.java:158)
	at org.apache.maven.surefire.booter.ForkedBooter.runSuitesInProcess(ForkedBooter.java:456)
	at org.apache.maven.surefire.booter.ForkedBooter.execute(ForkedBooter.java:169)
	at org.apache.maven.surefire.booter.ForkedBooter.run(ForkedBooter.java:595)
	at org.apache.maven.surefire.booter.ForkedBooter.main(ForkedBooter.java:581)

[ERROR] MessagingIntegrationTest.patchMessageTest  Time elapsed: 1.052 s  <<< FAILURE!
java.lang.AssertionError: expected:<200> but was:<400>
	at org.junit.Assert.fail(Assert.java:89)
	at org.junit.Assert.failNotEquals(Assert.java:835)
	at org.junit.Assert.assertEquals(Assert.java:647)
	at org.junit.Assert.assertEquals(Assert.java:633)
	at MessagingIntegrationTest.postAccountAndMessageTest(MessagingIntegrationTest.java:140)
	at MessagingIntegrationTest.patchMessageTest(MessagingIntegrationTest.java:465)
	at java.base/jdk.internal.reflect.NativeMethodAccessorImpl.invoke0(Native Method)
	at java.base/jdk.internal.reflect.NativeMethodAccessorImpl.invoke(NativeMethodAccessorImpl.java:62)
	at java.base/jdk.internal.reflect.DelegatingMethodAccessorImpl.invoke(DelegatingMethodAccessorImpl.java:43)
	at java.base/java.lang.reflect.Method.invoke(Method.java:566)
	at org.junit.runners.model.FrameworkMethod$1.runReflectiveCall(FrameworkMethod.java:59)
	at org.junit.internal.runners.model.ReflectiveCallable.run(ReflectiveCallable.java:12)
	at org.junit.runners.model.FrameworkMethod.invokeExplosively(FrameworkMethod.java:56)
	at org.junit.internal.runners.statements.InvokeMethod.evaluate(InvokeMethod.java:17)
	at org.junit.internal.runners.statements.RunBefores.evaluate(RunBefores.java:26)
	at org.junit.internal.runners.statements.RunAfters.evaluate(RunAfters.java:27)
	at org.junit.runners.ParentRunner$3.evaluate(ParentRunner.java:306)
	at org.junit.runners.BlockJUnit4ClassRunner$1.evaluate(BlockJUnit4ClassRunner.java:100)
	at org.junit.runners.ParentRunner.runLeaf(ParentRunner.java:366)
	at org.junit.runners.BlockJUnit4ClassRunner.runChild(BlockJUnit4ClassRunner.java:103)
	at org.junit.runners.BlockJUnit4ClassRunner.runChild(BlockJUnit4ClassRunner.java:63)
	at org.junit.runners.ParentRunner$4.run(ParentRunner.java:331)
	at org.junit.runners.ParentRunner$1.schedule(ParentRunner.java:79)
	at org.junit.runners.ParentRunner.runChildren(ParentRunner.java:329)
	at org.junit.runners.ParentRunner.access$100(ParentRunner.java:66)
	at org.junit.runners.ParentRunner$2.evaluate(ParentRunner.java:293)
	at org.junit.runners.ParentRunner$3.evaluate(ParentRunner.java:306)
	at org.junit.runners.ParentRunner.run(ParentRunner.java:413)
	at org.junit.runners.Suite.runChild(Suite.java:128)
	at org.junit.runners.Suite.runChild(Suite.java:27)
	at org.junit.runners.ParentRunner$4.run(ParentRunner.java:331)
	at org.junit.runners.ParentRunner$1.schedule(ParentRunner.java:79)
	at org.junit.runners.ParentRunner.runChildren(ParentRunner.java:329)
	at org.junit.runners.ParentRunner.access$100(ParentRunner.java:66)
	at org.junit.runners.ParentRunner$2.evaluate(ParentRunner.java:293)
	at org.junit.runners.ParentRunner$3.evaluate(ParentRunner.java:306)
	at org.junit.runners.ParentRunner.run(ParentRunner.java:413)
	at org.apache.maven.surefire.junitcore.JUnitCore.run(JUnitCore.java:55)
	at org.apache.maven.surefire.junitcore.JUnitCoreWrapper.createRequestAndRun(JUnitCoreWrapper.java:137)
	at org.apache.maven.surefire.junitcore.JUnitCoreWrapper.executeEager(JUnitCoreWrapper.java:107)
	at org.apache.maven.surefire.junitcore.JUnitCoreWrapper.execute(JUnitCoreWrapper.java:83)
	at org.apache.maven.surefire.junitcore.JUnitCoreWrapper.execute(JUnitCoreWrapper.java:75)
	at org.apache.maven.surefire.junitcore.JUnitCoreProvider.invoke(JUnitCoreProvider.java:158)
	at org.apache.maven.surefire.booter.ForkedBooter.runSuitesInProcess(ForkedBooter.java:456)
	at org.apache.maven.surefire.booter.ForkedBooter.execute(ForkedBooter.java:169)
	at org.apache.maven.surefire.booter.ForkedBooter.run(ForkedBooter.java:595)
	at org.apache.maven.surefire.booter.ForkedBooter.main(ForkedBooter.java:581)

[ERROR] MessagingIntegrationTest.postManyUsersAndMessagesThenGetAllMessages  Time elapsed: 1.033 s  <<< FAILURE!
java.lang.AssertionError: expected:<200> but was:<400>
	at org.junit.Assert.fail(Assert.java:89)
	at org.junit.Assert.failNotEquals(Assert.java:835)
	at org.junit.Assert.assertEquals(Assert.java:647)
	at org.junit.Assert.assertEquals(Assert.java:633)
	at MessagingIntegrationTest.postAccountAndMessageTest(MessagingIntegrationTest.java:140)
	at MessagingIntegrationTest.postManyAccountsAndMessagesTest(MessagingIntegrationTest.java:254)
	at MessagingIntegrationTest.postManyUsersAndMessagesThenGetAllMessages(MessagingIntegrationTest.java:298)
	at java.base/jdk.internal.reflect.NativeMethodAccessorImpl.invoke0(Native Method)
	at java.base/jdk.internal.reflect.NativeMethodAccessorImpl.invoke(NativeMethodAccessorImpl.java:62)
	at java.base/jdk.internal.reflect.DelegatingMethodAccessorImpl.invoke(DelegatingMethodAccessorImpl.java:43)
	at java.base/java.lang.reflect.Method.invoke(Method.java:566)
	at org.junit.runners.model.FrameworkMethod$1.runReflectiveCall(FrameworkMethod.java:59)
	at org.junit.internal.runners.model.ReflectiveCallable.run(ReflectiveCallable.java:12)
	at org.junit.runners.model.FrameworkMethod.invokeExplosively(FrameworkMethod.java:56)
	at org.junit.internal.runners.statements.InvokeMethod.evaluate(InvokeMethod.java:17)
	at org.junit.internal.runners.statements.RunBefores.evaluate(RunBefores.java:26)
	at org.junit.internal.runners.statements.RunAfters.evaluate(RunAfters.java:27)
	at org.junit.runners.ParentRunner$3.evaluate(ParentRunner.java:306)
	at org.junit.runners.BlockJUnit4ClassRunner$1.evaluate(BlockJUnit4ClassRunner.java:100)
	at org.junit.runners.ParentRunner.runLeaf(ParentRunner.java:366)
	at org.junit.runners.BlockJUnit4ClassRunner.runChild(BlockJUnit4ClassRunner.java:103)
	at org.junit.runners.BlockJUnit4ClassRunner.runChild(BlockJUnit4ClassRunner.java:63)
	at org.junit.runners.ParentRunner$4.run(ParentRunner.java:331)
	at org.junit.runners.ParentRunner$1.schedule(ParentRunner.java:79)
	at org.junit.runners.ParentRunner.runChildren(ParentRunner.java:329)
	at org.junit.runners.ParentRunner.access$100(ParentRunner.java:66)
	at org.junit.runners.ParentRunner$2.evaluate(ParentRunner.java:293)
	at org.junit.runners.ParentRunner$3.evaluate(ParentRunner.java:306)
	at org.junit.runners.ParentRunner.run(ParentRunner.java:413)
	at org.junit.runners.Suite.runChild(Suite.java:128)
	at org.junit.runners.Suite.runChild(Suite.java:27)
	at org.junit.runners.ParentRunner$4.run(ParentRunner.java:331)
	at org.junit.runners.ParentRunner$1.schedule(ParentRunner.java:79)
	at org.junit.runners.ParentRunner.runChildren(ParentRunner.java:329)
	at org.junit.runners.ParentRunner.access$100(ParentRunner.java:66)
	at org.junit.runners.ParentRunner$2.evaluate(ParentRunner.java:293)
	at org.junit.runners.ParentRunner$3.evaluate(ParentRunner.java:306)
	at org.junit.runners.ParentRunner.run(ParentRunner.java:413)
	at org.apache.maven.surefire.junitcore.JUnitCore.run(JUnitCore.java:55)
	at org.apache.maven.surefire.junitcore.JUnitCoreWrapper.createRequestAndRun(JUnitCoreWrapper.java:137)
	at org.apache.maven.surefire.junitcore.JUnitCoreWrapper.executeEager(JUnitCoreWrapper.java:107)
	at org.apache.maven.surefire.junitcore.JUnitCoreWrapper.execute(JUnitCoreWrapper.java:83)
	at org.apache.maven.surefire.junitcore.JUnitCoreWrapper.execute(JUnitCoreWrapper.java:75)
	at org.apache.maven.surefire.junitcore.JUnitCoreProvider.invoke(JUnitCoreProvider.java:158)
	at org.apache.maven.surefire.booter.ForkedBooter.runSuitesInProcess(ForkedBooter.java:456)
	at org.apache.maven.surefire.booter.ForkedBooter.execute(ForkedBooter.java:169)
	at org.apache.maven.surefire.booter.ForkedBooter.run(ForkedBooter.java:595)
	at org.apache.maven.surefire.booter.ForkedBooter.main(ForkedBooter.java:581)

[ERROR] MessagingIntegrationTest.postManyAccountsAndMessagesThenGetMessagesByAccountIdTest  Time elapsed: 1.034 s  <<< FAILURE!
java.lang.AssertionError: expected:<200> but was:<400>
	at org.junit.Assert.fail(Assert.java:89)
	at org.junit.Assert.failNotEquals(Assert.java:835)
	at org.junit.Assert.assertEquals(Assert.java:647)
	at org.junit.Assert.assertEquals(Assert.java:633)
	at MessagingIntegrationTest.postAccountAndMessageTest(MessagingIntegrationTest.java:140)
	at MessagingIntegrationTest.postManyAccountsAndMessagesTest(MessagingIntegrationTest.java:254)
	at MessagingIntegrationTest.postManyAccountsAndMessagesThenGetMessagesByAccountIdTest(MessagingIntegrationTest.java:349)
	at java.base/jdk.internal.reflect.NativeMethodAccessorImpl.invoke0(Native Method)
	at java.base/jdk.internal.reflect.NativeMethodAccessorImpl.invoke(NativeMethodAccessorImpl.java:62)
	at java.base/jdk.internal.reflect.DelegatingMethodAccessorImpl.invoke(DelegatingMethodAccessorImpl.java:43)
	at java.base/java.lang.reflect.Method.invoke(Method.java:566)
	at org.junit.runners.model.FrameworkMethod$1.runReflectiveCall(FrameworkMethod.java:59)
	at org.junit.internal.runners.model.ReflectiveCallable.run(ReflectiveCallable.java:12)
	at org.junit.runners.model.FrameworkMethod.invokeExplosively(FrameworkMethod.java:56)
	at org.junit.internal.runners.statements.InvokeMethod.evaluate(InvokeMethod.java:17)
	at org.junit.internal.runners.statements.RunBefores.evaluate(RunBefores.java:26)
	at org.junit.internal.runners.statements.RunAfters.evaluate(RunAfters.java:27)
	at org.junit.runners.ParentRunner$3.evaluate(ParentRunner.java:306)
	at org.junit.runners.BlockJUnit4ClassRunner$1.evaluate(BlockJUnit4ClassRunner.java:100)
	at org.junit.runners.ParentRunner.runLeaf(ParentRunner.java:366)
	at org.junit.runners.BlockJUnit4ClassRunner.runChild(BlockJUnit4ClassRunner.java:103)
	at org.junit.runners.BlockJUnit4ClassRunner.runChild(BlockJUnit4ClassRunner.java:63)
	at org.junit.runners.ParentRunner$4.run(ParentRunner.java:331)
	at org.junit.runners.ParentRunner$1.schedule(ParentRunner.java:79)
	at org.junit.runners.ParentRunner.runChildren(ParentRunner.java:329)
	at org.junit.runners.ParentRunner.access$100(ParentRunner.java:66)
	at org.junit.runners.ParentRunner$2.evaluate(ParentRunner.java:293)
	at org.junit.runners.ParentRunner$3.evaluate(ParentRunner.java:306)
	at org.junit.runners.ParentRunner.run(ParentRunner.java:413)
	at org.junit.runners.Suite.runChild(Suite.java:128)
	at org.junit.runners.Suite.runChild(Suite.java:27)
	at org.junit.runners.ParentRunner$4.run(ParentRunner.java:331)
	at org.junit.runners.ParentRunner$1.schedule(ParentRunner.java:79)
	at org.junit.runners.ParentRunner.runChildren(ParentRunner.java:329)
	at org.junit.runners.ParentRunner.access$100(ParentRunner.java:66)
	at org.junit.runners.ParentRunner$2.evaluate(ParentRunner.java:293)
	at org.junit.runners.ParentRunner$3.evaluate(ParentRunner.java:306)
	at org.junit.runners.ParentRunner.run(ParentRunner.java:413)
	at org.apache.maven.surefire.junitcore.JUnitCore.run(JUnitCore.java:55)
	at org.apache.maven.surefire.junitcore.JUnitCoreWrapper.createRequestAndRun(JUnitCoreWrapper.java:137)
	at org.apache.maven.surefire.junitcore.JUnitCoreWrapper.executeEager(JUnitCoreWrapper.java:107)
	at org.apache.maven.surefire.junitcore.JUnitCoreWrapper.execute(JUnitCoreWrapper.java:83)
	at org.apache.maven.surefire.junitcore.JUnitCoreWrapper.execute(JUnitCoreWrapper.java:75)
	at org.apache.maven.surefire.junitcore.JUnitCoreProvider.invoke(JUnitCoreProvider.java:158)
	at org.apache.maven.surefire.booter.ForkedBooter.runSuitesInProcess(ForkedBooter.java:456)
	at org.apache.maven.surefire.booter.ForkedBooter.execute(ForkedBooter.java:169)
	at org.apache.maven.surefire.booter.ForkedBooter.run(ForkedBooter.java:595)
	at org.apache.maven.surefire.booter.ForkedBooter.main(ForkedBooter.java:581)

[ERROR] MessagingIntegrationTest.deleteMessageTest  Time elapsed: 1.056 s  <<< FAILURE!
java.lang.AssertionError: expected:<200> but was:<400>
	at org.junit.Assert.fail(Assert.java:89)
	at org.junit.Assert.failNotEquals(Assert.java:835)
	at org.junit.Assert.assertEquals(Assert.java:647)
	at org.junit.Assert.assertEquals(Assert.java:633)
	at MessagingIntegrationTest.postAccountAndMessageTest(MessagingIntegrationTest.java:140)
	at MessagingIntegrationTest.deleteMessageTest(MessagingIntegrationTest.java:404)
	at java.base/jdk.internal.reflect.NativeMethodAccessorImpl.invoke0(Native Method)
	at java.base/jdk.internal.reflect.NativeMethodAccessorImpl.invoke(NativeMethodAccessorImpl.java:62)
	at java.base/jdk.internal.reflect.DelegatingMethodAccessorImpl.invoke(DelegatingMethodAccessorImpl.java:43)
	at java.base/java.lang.reflect.Method.invoke(Method.java:566)
	at org.junit.runners.model.FrameworkMethod$1.runReflectiveCall(FrameworkMethod.java:59)
	at org.junit.internal.runners.model.ReflectiveCallable.run(ReflectiveCallable.java:12)
	at org.junit.runners.model.FrameworkMethod.invokeExplosively(FrameworkMethod.java:56)
	at org.junit.internal.runners.statements.InvokeMethod.evaluate(InvokeMethod.java:17)
	at org.junit.internal.runners.statements.RunBefores.evaluate(RunBefores.java:26)
	at org.junit.internal.runners.statements.RunAfters.evaluate(RunAfters.java:27)
	at org.junit.runners.ParentRunner$3.evaluate(ParentRunner.java:306)
	at org.junit.runners.BlockJUnit4ClassRunner$1.evaluate(BlockJUnit4ClassRunner.java:100)
	at org.junit.runners.ParentRunner.runLeaf(ParentRunner.java:366)
	at org.junit.runners.BlockJUnit4ClassRunner.runChild(BlockJUnit4ClassRunner.java:103)
	at org.junit.runners.BlockJUnit4ClassRunner.runChild(BlockJUnit4ClassRunner.java:63)
	at org.junit.runners.ParentRunner$4.run(ParentRunner.java:331)
	at org.junit.runners.ParentRunner$1.schedule(ParentRunner.java:79)
	at org.junit.runners.ParentRunner.runChildren(ParentRunner.java:329)
	at org.junit.runners.ParentRunner.access$100(ParentRunner.java:66)
	at org.junit.runners.ParentRunner$2.evaluate(ParentRunner.java:293)
	at org.junit.runners.ParentRunner$3.evaluate(ParentRunner.java:306)
	at org.junit.runners.ParentRunner.run(ParentRunner.java:413)
	at org.junit.runners.Suite.runChild(Suite.java:128)
	at org.junit.runners.Suite.runChild(Suite.java:27)
	at org.junit.runners.ParentRunner$4.run(ParentRunner.java:331)
	at org.junit.runners.ParentRunner$1.schedule(ParentRunner.java:79)
	at org.junit.runners.ParentRunner.runChildren(ParentRunner.java:329)
	at org.junit.runners.ParentRunner.access$100(ParentRunner.java:66)
	at org.junit.runners.ParentRunner$2.evaluate(ParentRunner.java:293)
	at org.junit.runners.ParentRunner$3.evaluate(ParentRunner.java:306)
	at org.junit.runners.ParentRunner.run(ParentRunner.java:413)
	at org.apache.maven.surefire.junitcore.JUnitCore.run(JUnitCore.java:55)
	at org.apache.maven.surefire.junitcore.JUnitCoreWrapper.createRequestAndRun(JUnitCoreWrapper.java:137)
	at org.apache.maven.surefire.junitcore.JUnitCoreWrapper.executeEager(JUnitCoreWrapper.java:107)
	at org.apache.maven.surefire.junitcore.JUnitCoreWrapper.execute(JUnitCoreWrapper.java:83)
	at org.apache.maven.surefire.junitcore.JUnitCoreWrapper.execute(JUnitCoreWrapper.java:75)
	at org.apache.maven.surefire.junitcore.JUnitCoreProvider.invoke(JUnitCoreProvider.java:158)
	at org.apache.maven.surefire.booter.ForkedBooter.runSuitesInProcess(ForkedBooter.java:456)
	at org.apache.maven.surefire.booter.ForkedBooter.execute(ForkedBooter.java:169)
	at org.apache.maven.surefire.booter.ForkedBooter.run(ForkedBooter.java:595)
	at org.apache.maven.surefire.booter.ForkedBooter.main(ForkedBooter.java:581)

[ERROR] MessagingIntegrationTest.getMessageAfterPatchTest  Time elapsed: 1.056 s  <<< FAILURE!
java.lang.AssertionError: expected:<200> but was:<400>
	at org.junit.Assert.fail(Assert.java:89)
	at org.junit.Assert.failNotEquals(Assert.java:835)
	at org.junit.Assert.assertEquals(Assert.java:647)
	at org.junit.Assert.assertEquals(Assert.java:633)
	at MessagingIntegrationTest.postAccountAndMessageTest(MessagingIntegrationTest.java:140)
	at MessagingIntegrationTest.patchMessageTest(MessagingIntegrationTest.java:465)
	at MessagingIntegrationTest.getMessageAfterPatchTest(MessagingIntegrationTest.java:490)
	at java.base/jdk.internal.reflect.NativeMethodAccessorImpl.invoke0(Native Method)
	at java.base/jdk.internal.reflect.NativeMethodAccessorImpl.invoke(NativeMethodAccessorImpl.java:62)
	at java.base/jdk.internal.reflect.DelegatingMethodAccessorImpl.invoke(DelegatingMethodAccessorImpl.java:43)
	at java.base/java.lang.reflect.Method.invoke(Method.java:566)
	at org.junit.runners.model.FrameworkMethod$1.runReflectiveCall(FrameworkMethod.java:59)
	at org.junit.internal.runners.model.ReflectiveCallable.run(ReflectiveCallable.java:12)
	at org.junit.runners.model.FrameworkMethod.invokeExplosively(FrameworkMethod.java:56)
	at org.junit.internal.runners.statements.InvokeMethod.evaluate(InvokeMethod.java:17)
	at org.junit.internal.runners.statements.RunBefores.evaluate(RunBefores.java:26)
	at org.junit.internal.runners.statements.RunAfters.evaluate(RunAfters.java:27)
	at org.junit.runners.ParentRunner$3.evaluate(ParentRunner.java:306)
	at org.junit.runners.BlockJUnit4ClassRunner$1.evaluate(BlockJUnit4ClassRunner.java:100)
	at org.junit.runners.ParentRunner.runLeaf(ParentRunner.java:366)
	at org.junit.runners.BlockJUnit4ClassRunner.runChild(BlockJUnit4ClassRunner.java:103)
	at org.junit.runners.BlockJUnit4ClassRunner.runChild(BlockJUnit4ClassRunner.java:63)
	at org.junit.runners.ParentRunner$4.run(ParentRunner.java:331)
	at org.junit.runners.ParentRunner$1.schedule(ParentRunner.java:79)
	at org.junit.runners.ParentRunner.runChildren(ParentRunner.java:329)
	at org.junit.runners.ParentRunner.access$100(ParentRunner.java:66)
	at org.junit.runners.ParentRunner$2.evaluate(ParentRunner.java:293)
	at org.junit.runners.ParentRunner$3.evaluate(ParentRunner.java:306)
	at org.junit.runners.ParentRunner.run(ParentRunner.java:413)
	at org.junit.runners.Suite.runChild(Suite.java:128)
	at org.junit.runners.Suite.runChild(Suite.java:27)
	at org.junit.runners.ParentRunner$4.run(ParentRunner.java:331)
	at org.junit.runners.ParentRunner$1.schedule(ParentRunner.java:79)
	at org.junit.runners.ParentRunner.runChildren(ParentRunner.java:329)
	at org.junit.runners.ParentRunner.access$100(ParentRunner.java:66)
	at org.junit.runners.ParentRunner$2.evaluate(ParentRunner.java:293)
	at org.junit.runners.ParentRunner$3.evaluate(ParentRunner.java:306)
	at org.junit.runners.ParentRunner.run(ParentRunner.java:413)
	at org.apache.maven.surefire.junitcore.JUnitCore.run(JUnitCore.java:55)
	at org.apache.maven.surefire.junitcore.JUnitCoreWrapper.createRequestAndRun(JUnitCoreWrapper.java:137)
	at org.apache.maven.surefire.junitcore.JUnitCoreWrapper.executeEager(JUnitCoreWrapper.java:107)
	at org.apache.maven.surefire.junitcore.JUnitCoreWrapper.execute(JUnitCoreWrapper.java:83)
	at org.apache.maven.surefire.junitcore.JUnitCoreWrapper.execute(JUnitCoreWrapper.java:75)
	at org.apache.maven.surefire.junitcore.JUnitCoreProvider.invoke(JUnitCoreProvider.java:158)
	at org.apache.maven.surefire.booter.ForkedBooter.runSuitesInProcess(ForkedBooter.java:456)
	at org.apache.maven.surefire.booter.ForkedBooter.execute(ForkedBooter.java:169)
	at org.apache.maven.surefire.booter.ForkedBooter.run(ForkedBooter.java:595)
	at org.apache.maven.surefire.booter.ForkedBooter.main(ForkedBooter.java:581)

[ERROR] MessagingIntegrationTest.patchMessageTooLongTest  Time elapsed: 1.028 s  <<< FAILURE!
java.lang.AssertionError: expected:<200> but was:<400>
	at org.junit.Assert.fail(Assert.java:89)
	at org.junit.Assert.failNotEquals(Assert.java:835)
	at org.junit.Assert.assertEquals(Assert.java:647)
	at org.junit.Assert.assertEquals(Assert.java:633)
	at MessagingIntegrationTest.postAccountAndMessageTest(MessagingIntegrationTest.java:140)
	at MessagingIntegrationTest.patchMessageTooLongTest(MessagingIntegrationTest.java:512)
	at java.base/jdk.internal.reflect.NativeMethodAccessorImpl.invoke0(Native Method)
	at java.base/jdk.internal.reflect.NativeMethodAccessorImpl.invoke(NativeMethodAccessorImpl.java:62)
	at java.base/jdk.internal.reflect.DelegatingMethodAccessorImpl.invoke(DelegatingMethodAccessorImpl.java:43)
	at java.base/java.lang.reflect.Method.invoke(Method.java:566)
	at org.junit.runners.model.FrameworkMethod$1.runReflectiveCall(FrameworkMethod.java:59)
	at org.junit.internal.runners.model.ReflectiveCallable.run(ReflectiveCallable.java:12)
	at org.junit.runners.model.FrameworkMethod.invokeExplosively(FrameworkMethod.java:56)
	at org.junit.internal.runners.statements.InvokeMethod.evaluate(InvokeMethod.java:17)
	at org.junit.internal.runners.statements.RunBefores.evaluate(RunBefores.java:26)
	at org.junit.internal.runners.statements.RunAfters.evaluate(RunAfters.java:27)
	at org.junit.runners.ParentRunner$3.evaluate(ParentRunner.java:306)
	at org.junit.runners.BlockJUnit4ClassRunner$1.evaluate(BlockJUnit4ClassRunner.java:100)
	at org.junit.runners.ParentRunner.runLeaf(ParentRunner.java:366)
	at org.junit.runners.BlockJUnit4ClassRunner.runChild(BlockJUnit4ClassRunner.java:103)
	at org.junit.runners.BlockJUnit4ClassRunner.runChild(BlockJUnit4ClassRunner.java:63)
	at org.junit.runners.ParentRunner$4.run(ParentRunner.java:331)
	at org.junit.runners.ParentRunner$1.schedule(ParentRunner.java:79)
	at org.junit.runners.ParentRunner.runChildren(ParentRunner.java:329)
	at org.junit.runners.ParentRunner.access$100(ParentRunner.java:66)
	at org.junit.runners.ParentRunner$2.evaluate(ParentRunner.java:293)
	at org.junit.runners.ParentRunner$3.evaluate(ParentRunner.java:306)
	at org.junit.runners.ParentRunner.run(ParentRunner.java:413)
	at org.junit.runners.Suite.runChild(Suite.java:128)
	at org.junit.runners.Suite.runChild(Suite.java:27)
	at org.junit.runners.ParentRunner$4.run(ParentRunner.java:331)
	at org.junit.runners.ParentRunner$1.schedule(ParentRunner.java:79)
	at org.junit.runners.ParentRunner.runChildren(ParentRunner.java:329)
	at org.junit.runners.ParentRunner.access$100(ParentRunner.java:66)
	at org.junit.runners.ParentRunner$2.evaluate(ParentRunner.java:293)
	at org.junit.runners.ParentRunner$3.evaluate(ParentRunner.java:306)
	at org.junit.runners.ParentRunner.run(ParentRunner.java:413)
	at org.apache.maven.surefire.junitcore.JUnitCore.run(JUnitCore.java:55)
	at org.apache.maven.surefire.junitcore.JUnitCoreWrapper.createRequestAndRun(JUnitCoreWrapper.java:137)
	at org.apache.maven.surefire.junitcore.JUnitCoreWrapper.executeEager(JUnitCoreWrapper.java:107)
	at org.apache.maven.surefire.junitcore.JUnitCoreWrapper.execute(JUnitCoreWrapper.java:83)
	at org.apache.maven.surefire.junitcore.JUnitCoreWrapper.execute(JUnitCoreWrapper.java:75)
	at org.apache.maven.surefire.junitcore.JUnitCoreProvider.invoke(JUnitCoreProvider.java:158)
	at org.apache.maven.surefire.booter.ForkedBooter.runSuitesInProcess(ForkedBooter.java:456)
	at org.apache.maven.surefire.booter.ForkedBooter.execute(ForkedBooter.java:169)
	at org.apache.maven.surefire.booter.ForkedBooter.run(ForkedBooter.java:595)
	at org.apache.maven.surefire.booter.ForkedBooter.main(ForkedBooter.java:581)

[ERROR] MessagingIntegrationTest.getMessagesByAccountIdEmpty  Time elapsed: 1.033 s  <<< ERROR!
com.fasterxml.jackson.databind.exc.MismatchedInputException: 
No content to map due to end-of-input
 at [Source: (String)""; line: 1, column: 0]
	at com.fasterxml.jackson.databind.exc.MismatchedInputException.from(MismatchedInputException.java:59)
	at com.fasterxml.jackson.databind.ObjectMapper._initForReading(ObjectMapper.java:4788)
	at com.fasterxml.jackson.databind.ObjectMapper._readMapAndClose(ObjectMapper.java:4690)
	at com.fasterxml.jackson.databind.ObjectMapper.readValue(ObjectMapper.java:3652)
	at com.fasterxml.jackson.databind.ObjectMapper.readValue(ObjectMapper.java:3635)
	at MessagingIntegrationTest.getMessagesByAccountIdEmpty(MessagingIntegrationTest.java:335)
	at java.base/jdk.internal.reflect.NativeMethodAccessorImpl.invoke0(Native Method)
	at java.base/jdk.internal.reflect.NativeMethodAccessorImpl.invoke(NativeMethodAccessorImpl.java:62)
	at java.base/jdk.internal.reflect.DelegatingMethodAccessorImpl.invoke(DelegatingMethodAccessorImpl.java:43)
	at java.base/java.lang.reflect.Method.invoke(Method.java:566)
	at org.junit.runners.model.FrameworkMethod$1.runReflectiveCall(FrameworkMethod.java:59)
	at org.junit.internal.runners.model.ReflectiveCallable.run(ReflectiveCallable.java:12)
	at org.junit.runners.model.FrameworkMethod.invokeExplosively(FrameworkMethod.java:56)
	at org.junit.internal.runners.statements.InvokeMethod.evaluate(InvokeMethod.java:17)
	at org.junit.internal.runners.statements.RunBefores.evaluate(RunBefores.java:26)
	at org.junit.internal.runners.statements.RunAfters.evaluate(RunAfters.java:27)
	at org.junit.runners.ParentRunner$3.evaluate(ParentRunner.java:306)
	at org.junit.runners.BlockJUnit4ClassRunner$1.evaluate(BlockJUnit4ClassRunner.java:100)
	at org.junit.runners.ParentRunner.runLeaf(ParentRunner.java:366)
	at org.junit.runners.BlockJUnit4ClassRunner.runChild(BlockJUnit4ClassRunner.java:103)
	at org.junit.runners.BlockJUnit4ClassRunner.runChild(BlockJUnit4ClassRunner.java:63)
	at org.junit.runners.ParentRunner$4.run(ParentRunner.java:331)
	at org.junit.runners.ParentRunner$1.schedule(ParentRunner.java:79)
	at org.junit.runners.ParentRunner.runChildren(ParentRunner.java:329)
	at org.junit.runners.ParentRunner.access$100(ParentRunner.java:66)
	at org.junit.runners.ParentRunner$2.evaluate(ParentRunner.java:293)
	at org.junit.runners.ParentRunner$3.evaluate(ParentRunner.java:306)
	at org.junit.runners.ParentRunner.run(ParentRunner.java:413)
	at org.junit.runners.Suite.runChild(Suite.java:128)
	at org.junit.runners.Suite.runChild(Suite.java:27)
	at org.junit.runners.ParentRunner$4.run(ParentRunner.java:331)
	at org.junit.runners.ParentRunner$1.schedule(ParentRunner.java:79)
	at org.junit.runners.ParentRunner.runChildren(ParentRunner.java:329)
	at org.junit.runners.ParentRunner.access$100(ParentRunner.java:66)
	at org.junit.runners.ParentRunner$2.evaluate(ParentRunner.java:293)
	at org.junit.runners.ParentRunner$3.evaluate(ParentRunner.java:306)
	at org.junit.runners.ParentRunner.run(ParentRunner.java:413)
	at org.apache.maven.surefire.junitcore.JUnitCore.run(JUnitCore.java:55)
	at org.apache.maven.surefire.junitcore.JUnitCoreWrapper.createRequestAndRun(JUnitCoreWrapper.java:137)
	at org.apache.maven.surefire.junitcore.JUnitCoreWrapper.executeEager(JUnitCoreWrapper.java:107)
	at org.apache.maven.surefire.junitcore.JUnitCoreWrapper.execute(JUnitCoreWrapper.java:83)
	at org.apache.maven.surefire.junitcore.JUnitCoreWrapper.execute(JUnitCoreWrapper.java:75)
	at org.apache.maven.surefire.junitcore.JUnitCoreProvider.invoke(JUnitCoreProvider.java:158)
	at org.apache.maven.surefire.booter.ForkedBooter.runSuitesInProcess(ForkedBooter.java:456)
	at org.apache.maven.surefire.booter.ForkedBooter.execute(ForkedBooter.java:169)
	at org.apache.maven.surefire.booter.ForkedBooter.run(ForkedBooter.java:595)
	at org.apache.maven.surefire.booter.ForkedBooter.main(ForkedBooter.java:581)

[ERROR] MessagingIntegrationTest.deletedMessageShouldNotExistTest  Time elapsed: 1.046 s  <<< FAILURE!
java.lang.AssertionError: expected:<200> but was:<400>
	at org.junit.Assert.fail(Assert.java:89)
	at org.junit.Assert.failNotEquals(Assert.java:835)
	at org.junit.Assert.assertEquals(Assert.java:647)
	at org.junit.Assert.assertEquals(Assert.java:633)
	at MessagingIntegrationTest.postAccountAndMessageTest(MessagingIntegrationTest.java:140)
	at MessagingIntegrationTest.deleteMessageTest(MessagingIntegrationTest.java:404)
	at MessagingIntegrationTest.deletedMessageShouldNotExistTest(MessagingIntegrationTest.java:426)
	at java.base/jdk.internal.reflect.NativeMethodAccessorImpl.invoke0(Native Method)
	at java.base/jdk.internal.reflect.NativeMethodAccessorImpl.invoke(NativeMethodAccessorImpl.java:62)
	at java.base/jdk.internal.reflect.DelegatingMethodAccessorImpl.invoke(DelegatingMethodAccessorImpl.java:43)
	at java.base/java.lang.reflect.Method.invoke(Method.java:566)
	at org.junit.runners.model.FrameworkMethod$1.runReflectiveCall(FrameworkMethod.java:59)
	at org.junit.internal.runners.model.ReflectiveCallable.run(ReflectiveCallable.java:12)
	at org.junit.runners.model.FrameworkMethod.invokeExplosively(FrameworkMethod.java:56)
	at org.junit.internal.runners.statements.InvokeMethod.evaluate(InvokeMethod.java:17)
	at org.junit.internal.runners.statements.RunBefores.evaluate(RunBefores.java:26)
	at org.junit.internal.runners.statements.RunAfters.evaluate(RunAfters.java:27)
	at org.junit.runners.ParentRunner$3.evaluate(ParentRunner.java:306)
	at org.junit.runners.BlockJUnit4ClassRunner$1.evaluate(BlockJUnit4ClassRunner.java:100)
	at org.junit.runners.ParentRunner.runLeaf(ParentRunner.java:366)
	at org.junit.runners.BlockJUnit4ClassRunner.runChild(BlockJUnit4ClassRunner.java:103)
	at org.junit.runners.BlockJUnit4ClassRunner.runChild(BlockJUnit4ClassRunner.java:63)
	at org.junit.runners.ParentRunner$4.run(ParentRunner.java:331)
	at org.junit.runners.ParentRunner$1.schedule(ParentRunner.java:79)
	at org.junit.runners.ParentRunner.runChildren(ParentRunner.java:329)
	at org.junit.runners.ParentRunner.access$100(ParentRunner.java:66)
	at org.junit.runners.ParentRunner$2.evaluate(ParentRunner.java:293)
	at org.junit.runners.ParentRunner$3.evaluate(ParentRunner.java:306)
	at org.junit.runners.ParentRunner.run(ParentRunner.java:413)
	at org.junit.runners.Suite.runChild(Suite.java:128)
	at org.junit.runners.Suite.runChild(Suite.java:27)
	at org.junit.runners.ParentRunner$4.run(ParentRunner.java:331)
	at org.junit.runners.ParentRunner$1.schedule(ParentRunner.java:79)
	at org.junit.runners.ParentRunner.runChildren(ParentRunner.java:329)
	at org.junit.runners.ParentRunner.access$100(ParentRunner.java:66)
	at org.junit.runners.ParentRunner$2.evaluate(ParentRunner.java:293)
	at org.junit.runners.ParentRunner$3.evaluate(ParentRunner.java:306)
	at org.junit.runners.ParentRunner.run(ParentRunner.java:413)
	at org.apache.maven.surefire.junitcore.JUnitCore.run(JUnitCore.java:55)
	at org.apache.maven.surefire.junitcore.JUnitCoreWrapper.createRequestAndRun(JUnitCoreWrapper.java:137)
	at org.apache.maven.surefire.junitcore.JUnitCoreWrapper.executeEager(JUnitCoreWrapper.java:107)
	at org.apache.maven.surefire.junitcore.JUnitCoreWrapper.execute(JUnitCoreWrapper.java:83)
	at org.apache.maven.surefire.junitcore.JUnitCoreWrapper.execute(JUnitCoreWrapper.java:75)
	at org.apache.maven.surefire.junitcore.JUnitCoreProvider.invoke(JUnitCoreProvider.java:158)
	at org.apache.maven.surefire.booter.ForkedBooter.runSuitesInProcess(ForkedBooter.java:456)
	at org.apache.maven.surefire.booter.ForkedBooter.execute(ForkedBooter.java:169)
	at org.apache.maven.surefire.booter.ForkedBooter.run(ForkedBooter.java:595)
	at org.apache.maven.surefire.booter.ForkedBooter.main(ForkedBooter.java:581)

[ERROR] MessagingIntegrationTest.patchMessageBlankTest  Time elapsed: 1.029 s  <<< FAILURE!
java.lang.AssertionError: expected:<200> but was:<400>
	at org.junit.Assert.fail(Assert.java:89)
	at org.junit.Assert.failNotEquals(Assert.java:835)
	at org.junit.Assert.assertEquals(Assert.java:647)
	at org.junit.Assert.assertEquals(Assert.java:633)
	at MessagingIntegrationTest.postAccountAndMessageTest(MessagingIntegrationTest.java:140)
	at MessagingIntegrationTest.patchMessageBlankTest(MessagingIntegrationTest.java:537)
	at java.base/jdk.internal.reflect.NativeMethodAccessorImpl.invoke0(Native Method)
	at java.base/jdk.internal.reflect.NativeMethodAccessorImpl.invoke(NativeMethodAccessorImpl.java:62)
	at java.base/jdk.internal.reflect.DelegatingMethodAccessorImpl.invoke(DelegatingMethodAccessorImpl.java:43)
	at java.base/java.lang.reflect.Method.invoke(Method.java:566)
	at org.junit.runners.model.FrameworkMethod$1.runReflectiveCall(FrameworkMethod.java:59)
	at org.junit.internal.runners.model.ReflectiveCallable.run(ReflectiveCallable.java:12)
	at org.junit.runners.model.FrameworkMethod.invokeExplosively(FrameworkMethod.java:56)
	at org.junit.internal.runners.statements.InvokeMethod.evaluate(InvokeMethod.java:17)
	at org.junit.internal.runners.statements.RunBefores.evaluate(RunBefores.java:26)
	at org.junit.internal.runners.statements.RunAfters.evaluate(RunAfters.java:27)
	at org.junit.runners.ParentRunner$3.evaluate(ParentRunner.java:306)
	at org.junit.runners.BlockJUnit4ClassRunner$1.evaluate(BlockJUnit4ClassRunner.java:100)
	at org.junit.runners.ParentRunner.runLeaf(ParentRunner.java:366)
	at org.junit.runners.BlockJUnit4ClassRunner.runChild(BlockJUnit4ClassRunner.java:103)
	at org.junit.runners.BlockJUnit4ClassRunner.runChild(BlockJUnit4ClassRunner.java:63)
	at org.junit.runners.ParentRunner$4.run(ParentRunner.java:331)
	at org.junit.runners.ParentRunner$1.schedule(ParentRunner.java:79)
	at org.junit.runners.ParentRunner.runChildren(ParentRunner.java:329)
	at org.junit.runners.ParentRunner.access$100(ParentRunner.java:66)
	at org.junit.runners.ParentRunner$2.evaluate(ParentRunner.java:293)
	at org.junit.runners.ParentRunner$3.evaluate(ParentRunner.java:306)
	at org.junit.runners.ParentRunner.run(ParentRunner.java:413)
	at org.junit.runners.Suite.runChild(Suite.java:128)
	at org.junit.runners.Suite.runChild(Suite.java:27)
	at org.junit.runners.ParentRunner$4.run(ParentRunner.java:331)
	at org.junit.runners.ParentRunner$1.schedule(ParentRunner.java:79)
	at org.junit.runners.ParentRunner.runChildren(ParentRunner.java:329)
	at org.junit.runners.ParentRunner.access$100(ParentRunner.java:66)
	at org.junit.runners.ParentRunner$2.evaluate(ParentRunner.java:293)
	at org.junit.runners.ParentRunner$3.evaluate(ParentRunner.java:306)
	at org.junit.runners.ParentRunner.run(ParentRunner.java:413)
	at org.apache.maven.surefire.junitcore.JUnitCore.run(JUnitCore.java:55)
	at org.apache.maven.surefire.junitcore.JUnitCoreWrapper.createRequestAndRun(JUnitCoreWrapper.java:137)
	at org.apache.maven.surefire.junitcore.JUnitCoreWrapper.executeEager(JUnitCoreWrapper.java:107)
	at org.apache.maven.surefire.junitcore.JUnitCoreWrapper.execute(JUnitCoreWrapper.java:83)
	at org.apache.maven.surefire.junitcore.JUnitCoreWrapper.execute(JUnitCoreWrapper.java:75)
	at org.apache.maven.surefire.junitcore.JUnitCoreProvider.invoke(JUnitCoreProvider.java:158)
	at org.apache.maven.surefire.booter.ForkedBooter.runSuitesInProcess(ForkedBooter.java:456)
	at org.apache.maven.surefire.booter.ForkedBooter.execute(ForkedBooter.java:169)
	at org.apache.maven.surefire.booter.ForkedBooter.run(ForkedBooter.java:595)
	at org.apache.maven.surefire.booter.ForkedBooter.main(ForkedBooter.java:581)

[ERROR] MessagingIntegrationTest.patchMessageNonExistentMessageTest  Time elapsed: 1.057 s  <<< FAILURE!
java.lang.AssertionError: expected:<400> but was:<500>
	at org.junit.Assert.fail(Assert.java:89)
	at org.junit.Assert.failNotEquals(Assert.java:835)
	at org.junit.Assert.assertEquals(Assert.java:647)
	at org.junit.Assert.assertEquals(Assert.java:633)
	at MessagingIntegrationTest.patchMessageNonExistentMessageTest(MessagingIntegrationTest.java:454)
	at java.base/jdk.internal.reflect.NativeMethodAccessorImpl.invoke0(Native Method)
	at java.base/jdk.internal.reflect.NativeMethodAccessorImpl.invoke(NativeMethodAccessorImpl.java:62)
	at java.base/jdk.internal.reflect.DelegatingMethodAccessorImpl.invoke(DelegatingMethodAccessorImpl.java:43)
	at java.base/java.lang.reflect.Method.invoke(Method.java:566)
	at org.junit.runners.model.FrameworkMethod$1.runReflectiveCall(FrameworkMethod.java:59)
	at org.junit.internal.runners.model.ReflectiveCallable.run(ReflectiveCallable.java:12)
	at org.junit.runners.model.FrameworkMethod.invokeExplosively(FrameworkMethod.java:56)
	at org.junit.internal.runners.statements.InvokeMethod.evaluate(InvokeMethod.java:17)
	at org.junit.internal.runners.statements.RunBefores.evaluate(RunBefores.java:26)
	at org.junit.internal.runners.statements.RunAfters.evaluate(RunAfters.java:27)
	at org.junit.runners.ParentRunner$3.evaluate(ParentRunner.java:306)
	at org.junit.runners.BlockJUnit4ClassRunner$1.evaluate(BlockJUnit4ClassRunner.java:100)
	at org.junit.runners.ParentRunner.runLeaf(ParentRunner.java:366)
	at org.junit.runners.BlockJUnit4ClassRunner.runChild(BlockJUnit4ClassRunner.java:103)
	at org.junit.runners.BlockJUnit4ClassRunner.runChild(BlockJUnit4ClassRunner.java:63)
	at org.junit.runners.ParentRunner$4.run(ParentRunner.java:331)
	at org.junit.runners.ParentRunner$1.schedule(ParentRunner.java:79)
	at org.junit.runners.ParentRunner.runChildren(ParentRunner.java:329)
	at org.junit.runners.ParentRunner.access$100(ParentRunner.java:66)
	at org.junit.runners.ParentRunner$2.evaluate(ParentRunner.java:293)
	at org.junit.runners.ParentRunner$3.evaluate(ParentRunner.java:306)
	at org.junit.runners.ParentRunner.run(ParentRunner.java:413)
	at org.junit.runners.Suite.runChild(Suite.java:128)
	at org.junit.runners.Suite.runChild(Suite.java:27)
	at org.junit.runners.ParentRunner$4.run(ParentRunner.java:331)
	at org.junit.runners.ParentRunner$1.schedule(ParentRunner.java:79)
	at org.junit.runners.ParentRunner.runChildren(ParentRunner.java:329)
	at org.junit.runners.ParentRunner.access$100(ParentRunner.java:66)
	at org.junit.runners.ParentRunner$2.evaluate(ParentRunner.java:293)
	at org.junit.runners.ParentRunner$3.evaluate(ParentRunner.java:306)
	at org.junit.runners.ParentRunner.run(ParentRunner.java:413)
	at org.apache.maven.surefire.junitcore.JUnitCore.run(JUnitCore.java:55)
	at org.apache.maven.surefire.junitcore.JUnitCoreWrapper.createRequestAndRun(JUnitCoreWrapper.java:137)
	at org.apache.maven.surefire.junitcore.JUnitCoreWrapper.executeEager(JUnitCoreWrapper.java:107)
	at org.apache.maven.surefire.junitcore.JUnitCoreWrapper.execute(JUnitCoreWrapper.java:83)
	at org.apache.maven.surefire.junitcore.JUnitCoreWrapper.execute(JUnitCoreWrapper.java:75)
	at org.apache.maven.surefire.junitcore.JUnitCoreProvider.invoke(JUnitCoreProvider.java:158)
	at org.apache.maven.surefire.booter.ForkedBooter.runSuitesInProcess(ForkedBooter.java:456)
	at org.apache.maven.surefire.booter.ForkedBooter.execute(ForkedBooter.java:169)
	at org.apache.maven.surefire.booter.ForkedBooter.run(ForkedBooter.java:595)
	at org.apache.maven.surefire.booter.ForkedBooter.main(ForkedBooter.java:581)

[ERROR] MessagingIntegrationTest.postManyAccountsAndMessagesTest  Time elapsed: 1.028 s  <<< FAILURE!
java.lang.AssertionError: expected:<200> but was:<400>
	at org.junit.Assert.fail(Assert.java:89)
	at org.junit.Assert.failNotEquals(Assert.java:835)
	at org.junit.Assert.assertEquals(Assert.java:647)
	at org.junit.Assert.assertEquals(Assert.java:633)
	at MessagingIntegrationTest.postAccountAndMessageTest(MessagingIntegrationTest.java:140)
	at MessagingIntegrationTest.postManyAccountsAndMessagesTest(MessagingIntegrationTest.java:254)
	at java.base/jdk.internal.reflect.NativeMethodAccessorImpl.invoke0(Native Method)
	at java.base/jdk.internal.reflect.NativeMethodAccessorImpl.invoke(NativeMethodAccessorImpl.java:62)
	at java.base/jdk.internal.reflect.DelegatingMethodAccessorImpl.invoke(DelegatingMethodAccessorImpl.java:43)
	at java.base/java.lang.reflect.Method.invoke(Method.java:566)
	at org.junit.runners.model.FrameworkMethod$1.runReflectiveCall(FrameworkMethod.java:59)
	at org.junit.internal.runners.model.ReflectiveCallable.run(ReflectiveCallable.java:12)
	at org.junit.runners.model.FrameworkMethod.invokeExplosively(FrameworkMethod.java:56)
	at org.junit.internal.runners.statements.InvokeMethod.evaluate(InvokeMethod.java:17)
	at org.junit.internal.runners.statements.RunBefores.evaluate(RunBefores.java:26)
	at org.junit.internal.runners.statements.RunAfters.evaluate(RunAfters.java:27)
	at org.junit.runners.ParentRunner$3.evaluate(ParentRunner.java:306)
	at org.junit.runners.BlockJUnit4ClassRunner$1.evaluate(BlockJUnit4ClassRunner.java:100)
	at org.junit.runners.ParentRunner.runLeaf(ParentRunner.java:366)
	at org.junit.runners.BlockJUnit4ClassRunner.runChild(BlockJUnit4ClassRunner.java:103)
	at org.junit.runners.BlockJUnit4ClassRunner.runChild(BlockJUnit4ClassRunner.java:63)
	at org.junit.runners.ParentRunner$4.run(ParentRunner.java:331)
	at org.junit.runners.ParentRunner$1.schedule(ParentRunner.java:79)
	at org.junit.runners.ParentRunner.runChildren(ParentRunner.java:329)
	at org.junit.runners.ParentRunner.access$100(ParentRunner.java:66)
	at org.junit.runners.ParentRunner$2.evaluate(ParentRunner.java:293)
	at org.junit.runners.ParentRunner$3.evaluate(ParentRunner.java:306)
	at org.junit.runners.ParentRunner.run(ParentRunner.java:413)
	at org.junit.runners.Suite.runChild(Suite.java:128)
	at org.junit.runners.Suite.runChild(Suite.java:27)
	at org.junit.runners.ParentRunner$4.run(ParentRunner.java:331)
	at org.junit.runners.ParentRunner$1.schedule(ParentRunner.java:79)
	at org.junit.runners.ParentRunner.runChildren(ParentRunner.java:329)
	at org.junit.runners.ParentRunner.access$100(ParentRunner.java:66)
	at org.junit.runners.ParentRunner$2.evaluate(ParentRunner.java:293)
	at org.junit.runners.ParentRunner$3.evaluate(ParentRunner.java:306)
	at org.junit.runners.ParentRunner.run(ParentRunner.java:413)
	at org.apache.maven.surefire.junitcore.JUnitCore.run(JUnitCore.java:55)
	at org.apache.maven.surefire.junitcore.JUnitCoreWrapper.createRequestAndRun(JUnitCoreWrapper.java:137)
	at org.apache.maven.surefire.junitcore.JUnitCoreWrapper.executeEager(JUnitCoreWrapper.java:107)
	at org.apache.maven.surefire.junitcore.JUnitCoreWrapper.execute(JUnitCoreWrapper.java:83)
	at org.apache.maven.surefire.junitcore.JUnitCoreWrapper.execute(JUnitCoreWrapper.java:75)
	at org.apache.maven.surefire.junitcore.JUnitCoreProvider.invoke(JUnitCoreProvider.java:158)
	at org.apache.maven.surefire.booter.ForkedBooter.runSuitesInProcess(ForkedBooter.java:456)
	at org.apache.maven.surefire.booter.ForkedBooter.execute(ForkedBooter.java:169)
	at org.apache.maven.surefire.booter.ForkedBooter.run(ForkedBooter.java:595)
	at org.apache.maven.surefire.booter.ForkedBooter.main(ForkedBooter.java:581)

[ERROR] MessagingIntegrationTest.postAccountAndMessageTest  Time elapsed: 1.033 s  <<< FAILURE!
java.lang.AssertionError: expected:<200> but was:<400>
	at org.junit.Assert.fail(Assert.java:89)
	at org.junit.Assert.failNotEquals(Assert.java:835)
	at org.junit.Assert.assertEquals(Assert.java:647)
	at org.junit.Assert.assertEquals(Assert.java:633)
	at MessagingIntegrationTest.postAccountAndMessageTest(MessagingIntegrationTest.java:140)
	at java.base/jdk.internal.reflect.NativeMethodAccessorImpl.invoke0(Native Method)
	at java.base/jdk.internal.reflect.NativeMethodAccessorImpl.invoke(NativeMethodAccessorImpl.java:62)
	at java.base/jdk.internal.reflect.DelegatingMethodAccessorImpl.invoke(DelegatingMethodAccessorImpl.java:43)
	at java.base/java.lang.reflect.Method.invoke(Method.java:566)
	at org.junit.runners.model.FrameworkMethod$1.runReflectiveCall(FrameworkMethod.java:59)
	at org.junit.internal.runners.model.ReflectiveCallable.run(ReflectiveCallable.java:12)
	at org.junit.runners.model.FrameworkMethod.invokeExplosively(FrameworkMethod.java:56)
	at org.junit.internal.runners.statements.InvokeMethod.evaluate(InvokeMethod.java:17)
	at org.junit.internal.runners.statements.RunBefores.evaluate(RunBefores.java:26)
	at org.junit.internal.runners.statements.RunAfters.evaluate(RunAfters.java:27)
	at org.junit.runners.ParentRunner$3.evaluate(ParentRunner.java:306)
	at org.junit.runners.BlockJUnit4ClassRunner$1.evaluate(BlockJUnit4ClassRunner.java:100)
	at org.junit.runners.ParentRunner.runLeaf(ParentRunner.java:366)
	at org.junit.runners.BlockJUnit4ClassRunner.runChild(BlockJUnit4ClassRunner.java:103)
	at org.junit.runners.BlockJUnit4ClassRunner.runChild(BlockJUnit4ClassRunner.java:63)
	at org.junit.runners.ParentRunner$4.run(ParentRunner.java:331)
	at org.junit.runners.ParentRunner$1.schedule(ParentRunner.java:79)
	at org.junit.runners.ParentRunner.runChildren(ParentRunner.java:329)
	at org.junit.runners.ParentRunner.access$100(ParentRunner.java:66)
	at org.junit.runners.ParentRunner$2.evaluate(ParentRunner.java:293)
	at org.junit.runners.ParentRunner$3.evaluate(ParentRunner.java:306)
	at org.junit.runners.ParentRunner.run(ParentRunner.java:413)
	at org.junit.runners.Suite.runChild(Suite.java:128)
	at org.junit.runners.Suite.runChild(Suite.java:27)
	at org.junit.runners.ParentRunner$4.run(ParentRunner.java:331)
	at org.junit.runners.ParentRunner$1.schedule(ParentRunner.java:79)
	at org.junit.runners.ParentRunner.runChildren(ParentRunner.java:329)
	at org.junit.runners.ParentRunner.access$100(ParentRunner.java:66)
	at org.junit.runners.ParentRunner$2.evaluate(ParentRunner.java:293)
	at org.junit.runners.ParentRunner$3.evaluate(ParentRunner.java:306)
	at org.junit.runners.ParentRunner.run(ParentRunner.java:413)
	at org.apache.maven.surefire.junitcore.JUnitCore.run(JUnitCore.java:55)
	at org.apache.maven.surefire.junitcore.JUnitCoreWrapper.createRequestAndRun(JUnitCoreWrapper.java:137)
	at org.apache.maven.surefire.junitcore.JUnitCoreWrapper.executeEager(JUnitCoreWrapper.java:107)
	at org.apache.maven.surefire.junitcore.JUnitCoreWrapper.execute(JUnitCoreWrapper.java:83)
	at org.apache.maven.surefire.junitcore.JUnitCoreWrapper.execute(JUnitCoreWrapper.java:75)
	at org.apache.maven.surefire.junitcore.JUnitCoreProvider.invoke(JUnitCoreProvider.java:158)
	at org.apache.maven.surefire.booter.ForkedBooter.runSuitesInProcess(ForkedBooter.java:456)
	at org.apache.maven.surefire.booter.ForkedBooter.execute(ForkedBooter.java:169)
	at org.apache.maven.surefire.booter.ForkedBooter.run(ForkedBooter.java:595)
	at org.apache.maven.surefire.booter.ForkedBooter.main(ForkedBooter.java:581)

[ERROR] MessagingIntegrationTest.postAccountAndMessageAndGetAllMessagesTest  Time elapsed: 1.034 s  <<< FAILURE!
java.lang.AssertionError: expected:<200> but was:<400>
	at org.junit.Assert.fail(Assert.java:89)
	at org.junit.Assert.failNotEquals(Assert.java:835)
	at org.junit.Assert.assertEquals(Assert.java:647)
	at org.junit.Assert.assertEquals(Assert.java:633)
	at MessagingIntegrationTest.postAccountAndMessageTest(MessagingIntegrationTest.java:140)
	at MessagingIntegrationTest.postAccountAndMessageAndGetAllMessagesTest(MessagingIntegrationTest.java:230)
	at java.base/jdk.internal.reflect.NativeMethodAccessorImpl.invoke0(Native Method)
	at java.base/jdk.internal.reflect.NativeMethodAccessorImpl.invoke(NativeMethodAccessorImpl.java:62)
	at java.base/jdk.internal.reflect.DelegatingMethodAccessorImpl.invoke(DelegatingMethodAccessorImpl.java:43)
	at java.base/java.lang.reflect.Method.invoke(Method.java:566)
	at org.junit.runners.model.FrameworkMethod$1.runReflectiveCall(FrameworkMethod.java:59)
	at org.junit.internal.runners.model.ReflectiveCallable.run(ReflectiveCallable.java:12)
	at org.junit.runners.model.FrameworkMethod.invokeExplosively(FrameworkMethod.java:56)
	at org.junit.internal.runners.statements.InvokeMethod.evaluate(InvokeMethod.java:17)
	at org.junit.internal.runners.statements.RunBefores.evaluate(RunBefores.java:26)
	at org.junit.internal.runners.statements.RunAfters.evaluate(RunAfters.java:27)
	at org.junit.runners.ParentRunner$3.evaluate(ParentRunner.java:306)
	at org.junit.runners.BlockJUnit4ClassRunner$1.evaluate(BlockJUnit4ClassRunner.java:100)
	at org.junit.runners.ParentRunner.runLeaf(ParentRunner.java:366)
	at org.junit.runners.BlockJUnit4ClassRunner.runChild(BlockJUnit4ClassRunner.java:103)
	at org.junit.runners.BlockJUnit4ClassRunner.runChild(BlockJUnit4ClassRunner.java:63)
	at org.junit.runners.ParentRunner$4.run(ParentRunner.java:331)
	at org.junit.runners.ParentRunner$1.schedule(ParentRunner.java:79)
	at org.junit.runners.ParentRunner.runChildren(ParentRunner.java:329)
	at org.junit.runners.ParentRunner.access$100(ParentRunner.java:66)
	at org.junit.runners.ParentRunner$2.evaluate(ParentRunner.java:293)
	at org.junit.runners.ParentRunner$3.evaluate(ParentRunner.java:306)
	at org.junit.runners.ParentRunner.run(ParentRunner.java:413)
	at org.junit.runners.Suite.runChild(Suite.java:128)
	at org.junit.runners.Suite.runChild(Suite.java:27)
	at org.junit.runners.ParentRunner$4.run(ParentRunner.java:331)
	at org.junit.runners.ParentRunner$1.schedule(ParentRunner.java:79)
	at org.junit.runners.ParentRunner.runChildren(ParentRunner.java:329)
	at org.junit.runners.ParentRunner.access$100(ParentRunner.java:66)
	at org.junit.runners.ParentRunner$2.evaluate(ParentRunner.java:293)
	at org.junit.runners.ParentRunner$3.evaluate(ParentRunner.java:306)
	at org.junit.runners.ParentRunner.run(ParentRunner.java:413)
	at org.apache.maven.surefire.junitcore.JUnitCore.run(JUnitCore.java:55)
	at org.apache.maven.surefire.junitcore.JUnitCoreWrapper.createRequestAndRun(JUnitCoreWrapper.java:137)
	at org.apache.maven.surefire.junitcore.JUnitCoreWrapper.executeEager(JUnitCoreWrapper.java:107)
	at org.apache.maven.surefire.junitcore.JUnitCoreWrapper.execute(JUnitCoreWrapper.java:83)
	at org.apache.maven.surefire.junitcore.JUnitCoreWrapper.execute(JUnitCoreWrapper.java:75)
	at org.apache.maven.surefire.junitcore.JUnitCoreProvider.invoke(JUnitCoreProvider.java:158)
	at org.apache.maven.surefire.booter.ForkedBooter.runSuitesInProcess(ForkedBooter.java:456)
	at org.apache.maven.surefire.booter.ForkedBooter.execute(ForkedBooter.java:169)
	at org.apache.maven.surefire.booter.ForkedBooter.run(ForkedBooter.java:595)
	at org.apache.maven.surefire.booter.ForkedBooter.main(ForkedBooter.java:581)

[INFO] 
[INFO] Results:
[INFO] 
[ERROR] Failures: 
[ERROR]   MessagingIntegrationTest.deleteMessageNonExistentMessageTest:391 expected:<200> but was:<500>
[ERROR]   MessagingIntegrationTest.deleteMessageTest:404->postAccountAndMessageTest:140 expected:<200> but was:<400>
[ERROR]   MessagingIntegrationTest.deletedMessageShouldNotExistTest:426->deleteMessageTest:404->postAccountAndMessageTest:140 expected:<200> but was:<400>
[ERROR]   MessagingIntegrationTest.getMessageAfterPatchTest:490->patchMessageTest:465->postAccountAndMessageTest:140 expected:<200> but was:<400>
[ERROR]   MessagingIntegrationTest.patchMessageBlankTest:537->postAccountAndMessageTest:140 expected:<200> but was:<400>
[ERROR]   MessagingIntegrationTest.patchMessageNonExistentMessageTest:454 expected:<400> but was:<500>
[ERROR]   MessagingIntegrationTest.patchMessageTest:465->postAccountAndMessageTest:140 expected:<200> but was:<400>
[ERROR]   MessagingIntegrationTest.patchMessageTooLongTest:512->postAccountAndMessageTest:140 expected:<200> but was:<400>
[ERROR]   MessagingIntegrationTest.postAccountAndMessageAndGetAllMessagesTest:230->postAccountAndMessageTest:140 expected:<200> but was:<400>
[ERROR]   MessagingIntegrationTest.postAccountAndMessageTest:140 expected:<200> but was:<400>
[ERROR]   MessagingIntegrationTest.postAccountAndMessageThenGetMessageTest:207->postAccountAndMessageTest:140 expected:<200> but was:<400>
[ERROR]   MessagingIntegrationTest.postManyAccountsAndMessagesTest:254->postAccountAndMessageTest:140 expected:<200> but was:<400>
[ERROR]   MessagingIntegrationTest.postManyAccountsAndMessagesThenGetMessagesByAccountIdTest:349->postManyAccountsAndMessagesTest:254->postAccountAndMessageTest:140 expected:<200> but was:<400>
[ERROR]   MessagingIntegrationTest.postManyUsersAndMessagesThenGetAllMessages:298->postManyAccountsAndMessagesTest:254->postAccountAndMessageTest:140 expected:<200> but was:<400>
[ERROR] Errors: 
[ERROR]   MessagingIntegrationTest.getMessagesByAccountIdEmpty:335  MismatchedInput No content to map due to end-of-input
 at [Source: (String)""; line: 1, column: 0]
[INFO] 
[ERROR] Tests run: 27, Failures: 14, Errors: 1, Skipped: 0
[INFO] 
[INFO] ------------------------------------------------------------------------
[INFO] BUILD FAILURE
[INFO] ------------------------------------------------------------------------
[INFO] Total time:  36.976 s
[INFO] Finished at: 2023-02-15T12:05:39Z
[INFO] ------------------------------------------------------------------------
[ERROR] Failed to execute goal org.apache.maven.plugins:maven-surefire-plugin:3.0.0-M7:test (default-test) on project Challenges: There are test failures.
[ERROR] 
[ERROR] Please refer to /workspace/joy432-pep-project/target/surefire-reports for the individual test results.
[ERROR] Please refer to dump files (if any exist) [date].dump, [date]-jvmRun[N].dump and [date].dumpstream.
[ERROR] -> [Help 1]
[ERROR] 
[ERROR] To see the full stack trace of the errors, re-run Maven with the -e switch.
[ERROR] Re-run Maven using the -X switch to enable full debug logging.
[ERROR] 
[ERROR] For more information about the errors and possible solutions, please read the following articles:
[ERROR] [Help 1] http://cwiki.apache.org/confluence/display/MAVEN/MojoFailureException
